[
  {
    "id": "edamame",
    "name_zh": "毛豆（水煮）",
    "name_en": "Edamame, boiled",
    "category": "legume",
    "serving_g": 100,
    "serving_description_zh": "約 1/2 碗帶殼（淨重 100g）",
    "total_carbs_g": 8.5,
    "fiber_g": 4.0,
    "net_carbs_g": 4.5,
    "sugar_g": 2.0,
    "calories_kcal": 122,
    "taiwan_exchange_units": 0.3,
    "gi_estimated": 18,
    "gi_classification": "low",
    "gl_per_serving": 1,
    "source": "衛福部食藥署 TFND；Atkinson (2008)",
    "notes": "台灣居酒屋和超商最常見的低碳點心。蛋白質 11g/100g，飽足感強。GI 18 是所有常見食物中最低之一",
    "_meta": { "last_updated": "2026-04-07" }
  },
  {
    "id": "tofu-firm",
    "name_zh": "板豆腐（生）",
    "name_en": "Firm tofu, raw",
    "category": "legume",
    "serving_g": 100,
    "serving_description_zh": "約 1/3 塊板豆腐",
    "total_carbs_g": 2.5,
    "fiber_g": 0.3,
    "net_carbs_g": 2.2,
    "sugar_g": 0.5,
    "calories_kcal": 76,
    "taiwan_exchange_units": 0.1,
    "gi_estimated": 15,
    "gi_classification": "low",
    "gl_per_serving": 0,
    "source": "衛福部食藥署 TFND",
    "notes": "台灣傳統豆腐，碳水含量極低。蛋白質 8g/100g。適合低碳、糖尿病、減重飲食。注意：豆花（豆腐花）加糖水後碳水大幅上升",
    "_meta": { "last_updated": "2026-04-07" }
  },
  {
    "id": "tofu-silken",
    "name_zh": "嫩豆腐（盒裝）",
    "name_en": "Silken tofu",
    "category": "legume",
    "serving_g": 100,
    "serving_description_zh": "約 1/3 盒",
    "total_carbs_g": 2.0,
    "fiber_g": 0.1,
    "net_carbs_g": 1.9,
    "sugar_g": 0.5,
    "calories_kcal": 55,
    "taiwan_exchange_units": 0.1,
    "gi_estimated": 15,
    "gi_classification": "low",
    "gl_per_serving": 0,
    "source": "衛福部食藥署 TFND",
    "notes": "比板豆腐水分更高，蛋白質略低（5.5g/100g）。台灣超商常見盒裝嫩豆腐是低卡低碳的便利選擇",
    "_meta": { "last_updated": "2026-04-07" }
  },
  {
    "id": "black-bean-cooked",
    "name_zh": "黑豆（水煮）",
    "name_en": "Black beans, boiled",
    "category": "legume",
    "serving_g": 100,
    "serving_description_zh": "約 1/2 碗",
    "total_carbs_g": 23.5,
    "fiber_g": 7.5,
    "net_carbs_g": 16.0,
    "sugar_g": 0.5,
    "calories_kcal": 132,
    "taiwan_exchange_units": 1.1,
    "gi_estimated": 20,
    "gi_classification": "low",
    "gl_per_serving": 3,
    "source": "衛福部食藥署 TFND；Atkinson (2008)",
    "notes": "台灣傳統食材，蛋白質 9g/100g，膳食纖維豐富。儘管碳水總量高，GI 極低（20），GL 僅 3。花青素含量高，具抗氧化功效",
    "_meta": { "last_updated": "2026-04-07" }
  },
  {
    "id": "red-bean-cooked-unsweetened",
    "name_zh": "紅豆（水煮，無糖）",
    "name_en": "Red beans (adzuki), boiled, unsweetened",
    "category": "legume",
    "serving_g": 100,
    "serving_description_zh": "約 1/2 碗（無加糖水煮）",
    "total_carbs_g": 25.0,
    "fiber_g": 7.0,
    "net_carbs_g": 18.0,
    "sugar_g": 1.0,
    "calories_kcal": 136,
    "taiwan_exchange_units": 1.2,
    "gi_estimated": 33,
    "gi_classification": "low",
    "gl_per_serving": 6,
    "source": "衛福部食藥署 TFND；Atkinson (2008)",
    "notes": "台灣傳統甜品基底（紅豆湯、紅豆餅）。無糖水煮紅豆GI低，但加糖後碳水量暴增。蛋白質 8g/100g",
    "_meta": { "last_updated": "2026-04-07" }
  },
  {
    "id": "whole-milk",
    "name_zh": "全脂牛奶",
    "name_en": "Whole milk",
    "category": "dairy",
    "serving_g": 240,
    "serving_description_zh": "1 杯（240ml）= 衛福部 1 份乳品",
    "total_carbs_g": 12.0,
    "fiber_g": 0,
    "net_carbs_g": 12.0,
    "sugar_g": 12.0,
    "calories_kcal": 150,
    "taiwan_exchange_units": 1.0,
    "gi_estimated": 31,
    "gi_classification": "low",
    "gl_per_serving": 4,
    "source": "衛福部食藥署 TFND；衛福部每日飲食指南（2018）",
    "notes": "碳水全為乳糖（lactose），GI 低。台灣建議每日 1.5–2 份乳品。乳糖不耐者可選無乳糖牛奶（碳水相同，乳糖已水解）",
    "_meta": { "last_updated": "2026-04-07" }
  },
  {
    "id": "low-fat-milk",
    "name_zh": "低脂牛奶",
    "name_en": "Low-fat milk (1.5%)",
    "category": "dairy",
    "serving_g": 240,
    "serving_description_zh": "1 杯（240ml）= 衛福部 1 份乳品",
    "total_carbs_g": 12.0,
    "fiber_g": 0,
    "net_carbs_g": 12.0,
    "sugar_g": 12.0,
    "calories_kcal": 120,
    "taiwan_exchange_units": 1.0,
    "gi_estimated": 30,
    "gi_classification": "low",
    "gl_per_serving": 4,
    "source": "衛福部食藥署 TFND",
    "notes": "碳水量與全脂相同，熱量較低。適合減重期間維持乳品攝取。台灣林鳳營、瑞穗、光泉均有低脂版本",
    "_meta": { "last_updated": "2026-04-07" }
  },
  {
    "id": "greek-yogurt-unsweetened",
    "name_zh": "無糖希臘優格",
    "name_en": "Greek yogurt, plain, unsweetened",
    "category": "dairy",
    "serving_g": 200,
    "serving_description_zh": "1 小盒（200g）≈ 衛福部 0.8 份乳品",
    "total_carbs_g": 9.0,
    "fiber_g": 0,
    "net_carbs_g": 9.0,
    "sugar_g": 9.0,
    "calories_kcal": 118,
    "taiwan_exchange_units": 0.8,
    "gi_estimated": 11,
    "gi_classification": "low",
    "gl_per_serving": 1,
    "source": "衛福部食藥署 TFND；Atkinson (2008)",
    "notes": "蛋白質含量高（17g/200g），是普通優格的 2 倍。GI 極低（11）。台灣市面上有多個品牌，購買時確認成分無添加糖。加蜂蜜或果醬會顯著提升碳水量",
    "_meta": { "last_updated": "2026-04-07" }
  },
  {
    "id": "plain-yogurt-unsweetened",
    "name_zh": "無糖原味優格",
    "name_en": "Plain yogurt, unsweetened",
    "category": "dairy",
    "serving_g": 200,
    "serving_description_zh": "1 小盒（200g）≈ 衛福部 0.8 份乳品",
    "total_carbs_g": 10.0,
    "fiber_g": 0,
    "net_carbs_g": 10.0,
    "sugar_g": 10.0,
    "calories_kcal": 96,
    "taiwan_exchange_units": 0.8,
    "gi_estimated": 36,
    "gi_classification": "low",
    "gl_per_serving": 4,
    "source": "衛福部食藥署 TFND；Atkinson (2008)",
    "notes": "比希臘優格蛋白質低（6g/200g），碳水略高。含益生菌（L. acidophilus, Bifidobacterium）。台灣光泉、統一、福樂均有無糖版本",
    "_meta": { "last_updated": "2026-04-07" }
  },
  {
    "id": "soy-milk-unsweetened",
    "name_zh": "無糖豆漿",
    "name_en": "Soy milk, unsweetened",
    "category": "legume",
    "serving_g": 250,
    "serving_description_zh": "1 杯（250ml）",
    "total_carbs_g": 4.5,
    "fiber_g": 0.5,
    "net_carbs_g": 4.0,
    "sugar_g": 1.5,
    "calories_kcal": 93,
    "taiwan_exchange_units": 0.3,
    "gi_estimated": 34,
    "gi_classification": "low",
    "gl_per_serving": 1,
    "source": "衛福部食藥署 TFND",
    "notes": "台灣早餐文化的核心飲品。無糖豆漿碳水極低（4g/250ml），蛋白質 8g。注意：有糖豆漿（傳統豆漿店）含糖量通常額外加 10–15g 糖",
    "_meta": { "last_updated": "2026-04-07" }
  }
]
