[
  {
    "id": "white-rice-cooked",
    "name_zh": "白米飯（煮熟）",
    "name_en": "White rice, cooked",
    "category": "staple",
    "serving_g": 50,
    "serving_description_zh": "1/4 碗（糖尿病飲食的「1份主食」標準量）",
    "total_carbs_g": 18.5,
    "fiber_g": 0.2,
    "net_carbs_g": 18.3,
    "sugar_g": 0,
    "calories_kcal": 72,
    "taiwan_exchange_units": 1.2,
    "gi_estimated": 72,
    "gi_classification": "high",
    "gl_per_serving": 13,
    "diabetic_exchange_note_zh": "糖尿病衛教常用「半碗飯 = 2份主食 = 30g 碳水」換算",
    "source": "衛福部食藥署 TFND；衛福部每日飲食指南（2018）",
    "_meta": { "last_updated": "2026-04-07" }
  },
  {
    "id": "brown-rice-cooked",
    "name_zh": "糙米飯（煮熟）",
    "name_en": "Brown rice, cooked",
    "category": "staple",
    "serving_g": 50,
    "serving_description_zh": "1/4 碗",
    "total_carbs_g": 17.5,
    "fiber_g": 1.0,
    "net_carbs_g": 16.5,
    "sugar_g": 0,
    "calories_kcal": 70,
    "taiwan_exchange_units": 1.1,
    "gi_estimated": 55,
    "gi_classification": "low",
    "gl_per_serving": 9,
    "source": "衛福部食藥署 TFND；Atkinson (2008)",
    "notes": "糙米與白米碳水量相近，差異在於纖維（糙米 1g vs 白米 0.2g/50g）和 GI。血糖管理效果顯著更好",
    "_meta": { "last_updated": "2026-04-07" }
  },
  {
    "id": "sweet-potato-boiled",
    "name_zh": "地瓜（水煮）",
    "name_en": "Sweet potato, boiled",
    "category": "staple",
    "serving_g": 55,
    "serving_description_zh": "約 1/3 個中型地瓜",
    "total_carbs_g": 15.5,
    "fiber_g": 1.5,
    "net_carbs_g": 14.0,
    "sugar_g": 5.5,
    "calories_kcal": 60,
    "taiwan_exchange_units": 1.0,
    "gi_estimated": 46,
    "gi_classification": "low",
    "gl_per_serving": 6,
    "source": "衛福部食藥署 TFND；Atkinson (2008)",
    "notes": "水煮地瓜 GI 46 遠低於烤地瓜（GI 63–77）。台灣衛福部推薦的主食替換選項",
    "_meta": { "last_updated": "2026-04-07" }
  },
  {
    "id": "sweet-potato-baked",
    "name_zh": "地瓜（烤）",
    "name_en": "Sweet potato, baked",
    "category": "staple",
    "serving_g": 55,
    "serving_description_zh": "約 1/3 個中型地瓜",
    "total_carbs_g": 17.0,
    "fiber_g": 1.5,
    "net_carbs_g": 15.5,
    "sugar_g": 7.0,
    "calories_kcal": 65,
    "taiwan_exchange_units": 1.1,
    "gi_estimated": 63,
    "gi_classification": "medium",
    "gl_per_serving": 10,
    "source": "衛福部食藥署 TFND；Atkinson (2008)",
    "notes": "烤的過程使澱粉糊化程度更高，GI 比水煮高約 15–20 點。台灣夜市烤地瓜非常普遍",
    "_meta": { "last_updated": "2026-04-07" }
  },
  {
    "id": "oatmeal-cooked",
    "name_zh": "燕麥粥（即食燕麥片，熱水沖）",
    "name_en": "Oatmeal, instant, cooked",
    "category": "staple",
    "serving_g": 250,
    "serving_description_zh": "1 碗（約 40g 乾燕麥 + 210ml 水）",
    "total_carbs_g": 27.0,
    "fiber_g": 3.5,
    "net_carbs_g": 23.5,
    "sugar_g": 1.0,
    "calories_kcal": 138,
    "taiwan_exchange_units": 1.8,
    "gi_estimated": 55,
    "gi_classification": "low",
    "gl_per_serving": 13,
    "source": "衛福部食藥署 TFND；Atkinson (2008)",
    "notes": "即食燕麥片 GI 55，大燕麥片（rolled oats）GI 更低（約 42）。台灣超商和超市均有即食款，是早餐低 GI 首選",
    "_meta": { "last_updated": "2026-04-07" }
  },
  {
    "id": "white-bread-toast",
    "name_zh": "白吐司",
    "name_en": "White bread toast",
    "category": "staple",
    "serving_g": 30,
    "serving_description_zh": "1 片（薄片）",
    "total_carbs_g": 15.5,
    "fiber_g": 0.8,
    "net_carbs_g": 14.7,
    "sugar_g": 2.0,
    "calories_kcal": 83,
    "taiwan_exchange_units": 1.0,
    "gi_estimated": 70,
    "gi_classification": "high",
    "gl_per_serving": 10,
    "source": "衛福部食藥署 TFND；Atkinson (2008)",
    "notes": "台灣早餐店最常見的麵包類型。厚片吐司（60g）= 2份主食 = 30g 碳水",
    "_meta": { "last_updated": "2026-04-07" }
  },
  {
    "id": "whole-wheat-bread",
    "name_zh": "全麥吐司",
    "name_en": "Whole wheat bread",
    "category": "staple",
    "serving_g": 30,
    "serving_description_zh": "1 片",
    "total_carbs_g": 14.0,
    "fiber_g": 2.0,
    "net_carbs_g": 12.0,
    "sugar_g": 1.5,
    "calories_kcal": 75,
    "taiwan_exchange_units": 0.9,
    "gi_estimated": 49,
    "gi_classification": "low",
    "gl_per_serving": 6,
    "source": "衛福部食藥署 TFND；Atkinson (2008)",
    "notes": "注意：台灣市面上「全麥」麵包品質參差，有些僅添加少量全麥麵粉。查看成分標示，全麥麵粉應排在前兩位",
    "_meta": { "last_updated": "2026-04-07" }
  },
  {
    "id": "steamed-bun-plain",
    "name_zh": "饅頭（白麵，無餡）",
    "name_en": "Plain steamed bun (mantou)",
    "category": "staple",
    "serving_g": 65,
    "serving_description_zh": "1 個小饅頭",
    "total_carbs_g": 30.5,
    "fiber_g": 1.0,
    "net_carbs_g": 29.5,
    "sugar_g": 3.5,
    "calories_kcal": 152,
    "taiwan_exchange_units": 2.0,
    "gi_estimated": 68,
    "gi_classification": "medium",
    "gl_per_serving": 20,
    "source": "衛福部食藥署 TFND",
    "notes": "台灣早餐常見，1個饅頭相當於 2 份主食（約 1/2 碗白飯的碳水量）",
    "_meta": { "last_updated": "2026-04-07" }
  },
  {
    "id": "white-noodles-cooked",
    "name_zh": "白麵條（煮熟）",
    "name_en": "White wheat noodles, cooked",
    "category": "staple",
    "serving_g": 100,
    "serving_description_zh": "約 1/2 碗（煮熟）",
    "total_carbs_g": 26.5,
    "fiber_g": 1.0,
    "net_carbs_g": 25.5,
    "sugar_g": 0.5,
    "calories_kcal": 115,
    "taiwan_exchange_units": 1.7,
    "gi_estimated": 49,
    "gi_classification": "low",
    "gl_per_serving": 12,
    "source": "衛福部食藥署 TFND；Atkinson (2008)",
    "notes": "白麵條 GI（49）比白米飯（72）低，原因是麵條結構較緻密，澱粉消化較慢。台灣麵食文化豐富（意麵、陽春麵、刀削麵）",
    "_meta": { "last_updated": "2026-04-07" }
  },
  {
    "id": "corn-on-cob",
    "name_zh": "玉米（整根蒸煮）",
    "name_en": "Corn, steamed, on the cob",
    "category": "staple",
    "serving_g": 65,
    "serving_description_zh": "約 1/3 根中型玉米",
    "total_carbs_g": 16.0,
    "fiber_g": 1.5,
    "net_carbs_g": 14.5,
    "sugar_g": 3.5,
    "calories_kcal": 65,
    "taiwan_exchange_units": 1.0,
    "gi_estimated": 48,
    "gi_classification": "low",
    "gl_per_serving": 7,
    "source": "衛福部食藥署 TFND；Atkinson (2008)",
    "notes": "衛福部飲食指南將玉米歸類為「全穀雜糧類」而非蔬菜，需計入主食份數",
    "_meta": { "last_updated": "2026-04-07" }
  },
  {
    "id": "taro-steamed",
    "name_zh": "芋頭（蒸）",
    "name_en": "Taro, steamed",
    "category": "staple",
    "serving_g": 55,
    "serving_description_zh": "約 2 塊（切塊，55g）",
    "total_carbs_g": 15.5,
    "fiber_g": 1.8,
    "net_carbs_g": 13.7,
    "sugar_g": 0.8,
    "calories_kcal": 58,
    "taiwan_exchange_units": 1.0,
    "gi_estimated": 55,
    "gi_classification": "low",
    "gl_per_serving": 8,
    "source": "衛福部食藥署 TFND；Atkinson (2008)",
    "notes": "台灣常見根莖類主食，適合替換白米。注意：芋圓（加工後加糖）的碳水和糖分遠高於蒸芋頭",
    "_meta": { "last_updated": "2026-04-07" }
  },
  {
    "id": "rice-noodles-cooked",
    "name_zh": "米粉（煮熟）",
    "name_en": "Rice vermicelli, cooked",
    "category": "staple",
    "serving_g": 100,
    "serving_description_zh": "約 1/2 碗",
    "total_carbs_g": 24.0,
    "fiber_g": 0.4,
    "net_carbs_g": 23.6,
    "sugar_g": 0,
    "calories_kcal": 103,
    "taiwan_exchange_units": 1.6,
    "gi_estimated": 58,
    "gi_classification": "medium",
    "gl_per_serving": 14,
    "source": "衛福部食藥署 TFND",
    "notes": "台灣特色主食，纖維含量低，GI 介於白米和白麵之間",
    "_meta": { "last_updated": "2026-04-07" }
  }
]
