[
  {
    "id": "guava-taiwan-pearl",
    "name_zh": "芭樂（台灣珍珠芭樂）",
    "name_en": "Guava, Taiwan pearl variety",
    "category": "fruit",
    "serving_g": 155,
    "serving_description_zh": "約 1 顆小（155g）= 衛福部 1 份水果",
    "total_carbs_g": 15.5,
    "fiber_g": 5.5,
    "net_carbs_g": 10.0,
    "sugar_g": 9.0,
    "calories_kcal": 60,
    "taiwan_exchange_units": 1.0,
    "gi_estimated": 31,
    "gi_classification": "low",
    "gl_per_serving": 3,
    "source": "衛福部食藥署 TFND；衛福部每日飲食指南",
    "notes": "台灣所有水果中淨碳水最低、升糖負荷最低。維生素 C 含量極高（212mg/100g）。是糖尿病患者最安全的水果選項之一",
    "_meta": { "last_updated": "2026-04-07" }
  },
  {
    "id": "wax-apple",
    "name_zh": "蓮霧",
    "name_en": "Wax apple / Java apple",
    "category": "fruit",
    "serving_g": 180,
    "serving_description_zh": "約 2 顆（180g）= 衛福部 1 份水果",
    "total_carbs_g": 15.5,
    "fiber_g": 0.9,
    "net_carbs_g": 14.6,
    "sugar_g": 12.0,
    "calories_kcal": 58,
    "taiwan_exchange_units": 1.0,
    "gi_estimated": 38,
    "gi_classification": "low",
    "gl_per_serving": 6,
    "source": "衛福部食藥署 TFND",
    "notes": "台灣特有水果，水分含量高（93%），低熱量低 GI，適合作為清爽點心",
    "_meta": { "last_updated": "2026-04-07" }
  },
  {
    "id": "apple-medium",
    "name_zh": "蘋果（中型）",
    "name_en": "Apple, medium",
    "category": "fruit",
    "serving_g": 130,
    "serving_description_zh": "1 顆小（130g）= 衛福部 1 份水果",
    "total_carbs_g": 17.0,
    "fiber_g": 2.5,
    "net_carbs_g": 14.5,
    "sugar_g": 12.5,
    "calories_kcal": 65,
    "taiwan_exchange_units": 1.0,
    "gi_estimated": 36,
    "gi_classification": "low",
    "gl_per_serving": 5,
    "source": "衛福部食藥署 TFND；Atkinson (2008)",
    "_meta": { "last_updated": "2026-04-07" }
  },
  {
    "id": "banana-ripe",
    "name_zh": "香蕉（熟透）",
    "name_en": "Banana, ripe",
    "category": "fruit",
    "serving_g": 70,
    "serving_description_zh": "約 1/2 根中型香蕉（70g）= 衛福部 1 份水果",
    "total_carbs_g": 16.5,
    "fiber_g": 1.4,
    "net_carbs_g": 15.1,
    "sugar_g": 12.0,
    "calories_kcal": 63,
    "taiwan_exchange_units": 1.0,
    "gi_estimated": 62,
    "gi_classification": "medium",
    "gl_per_serving": 9,
    "source": "衛福部食藥署 TFND；Atkinson (2008)",
    "notes": "未熟香蕉 GI 約 30（抗性澱粉高）；熟透香蕉 GI 約 62（澱粉轉化為糖）。糖尿病患者建議選熟度適中的香蕉",
    "_meta": { "last_updated": "2026-04-07" }
  },
  {
    "id": "pineapple-taiwan",
    "name_zh": "鳳梨（台農金鑽）",
    "name_en": "Pineapple, Taiwan Gold Diamond",
    "category": "fruit",
    "serving_g": 130,
    "serving_description_zh": "約 5–6 塊（130g）= 衛福部 1 份水果",
    "total_carbs_g": 16.0,
    "fiber_g": 1.8,
    "net_carbs_g": 14.2,
    "sugar_g": 10.5,
    "calories_kcal": 62,
    "taiwan_exchange_units": 1.0,
    "gi_estimated": 59,
    "gi_classification": "medium",
    "gl_per_serving": 8,
    "source": "衛福部食藥署 TFND；Atkinson (2008)",
    "notes": "儘管 GI 屬中等，每份 GL 只有 8，屬低 GL。含鳳梨蛋白酶（bromelain），適量食用對消化有益",
    "_meta": { "last_updated": "2026-04-07" }
  },
  {
    "id": "mango-irwin",
    "name_zh": "芒果（愛文）",
    "name_en": "Mango, Irwin variety",
    "category": "fruit",
    "serving_g": 110,
    "serving_description_zh": "約 7–8 塊（110g）= 衛福部 1 份水果",
    "total_carbs_g": 15.5,
    "fiber_g": 1.0,
    "net_carbs_g": 14.5,
    "sugar_g": 13.0,
    "calories_kcal": 60,
    "taiwan_exchange_units": 1.0,
    "gi_estimated": 56,
    "gi_classification": "medium",
    "gl_per_serving": 8,
    "source": "衛福部食藥署 TFND",
    "notes": "台灣愛文芒果（6–8 月盛產）含糖量偏高，1 顆大型芒果（300g）可達 3 份水果碳水量",
    "_meta": { "last_updated": "2026-04-07" }
  },
  {
    "id": "watermelon",
    "name_zh": "西瓜",
    "name_en": "Watermelon",
    "category": "fruit",
    "serving_g": 250,
    "serving_description_zh": "約 2 片薄片（250g）= 衛福部 1 份水果",
    "total_carbs_g": 16.5,
    "fiber_g": 0.5,
    "net_carbs_g": 16.0,
    "sugar_g": 14.5,
    "calories_kcal": 63,
    "taiwan_exchange_units": 1.0,
    "gi_estimated": 76,
    "gi_classification": "high",
    "gl_per_serving": 12,
    "source": "衛福部食藥署 TFND；Atkinson (2008)",
    "notes": "西瓜 GI 高（76）但每份 GL 為 12（中等），因水分含量高（92%）。夏天適量食用（1份）對多數人是安全的",
    "_meta": { "last_updated": "2026-04-07" }
  },
  {
    "id": "papaya",
    "name_zh": "木瓜",
    "name_en": "Papaya",
    "category": "fruit",
    "serving_g": 150,
    "serving_description_zh": "約 4–5 塊（150g）= 衛福部 1 份水果",
    "total_carbs_g": 15.0,
    "fiber_g": 2.5,
    "net_carbs_g": 12.5,
    "sugar_g": 10.0,
    "calories_kcal": 57,
    "taiwan_exchange_units": 1.0,
    "gi_estimated": 60,
    "gi_classification": "medium",
    "gl_per_serving": 8,
    "source": "衛福部食藥署 TFND；Atkinson (2008)",
    "notes": "台灣早餐文化中常見，含木瓜蛋白酶（papain）。GI 中等，GL 低，適量食用沒有問題",
    "_meta": { "last_updated": "2026-04-07" }
  },
  {
    "id": "lychee",
    "name_zh": "荔枝",
    "name_en": "Lychee",
    "category": "fruit",
    "serving_g": 90,
    "serving_description_zh": "約 9 顆（90g）= 衛福部 1 份水果",
    "total_carbs_g": 15.5,
    "fiber_g": 0.8,
    "net_carbs_g": 14.7,
    "sugar_g": 14.0,
    "calories_kcal": 57,
    "taiwan_exchange_units": 1.0,
    "gi_estimated": 79,
    "gi_classification": "high",
    "gl_per_serving": 12,
    "source": "衛福部食藥署 TFND",
    "notes": "台灣夏季水果，含糖量高（以果糖為主），每份 GL 12。糖尿病患者應嚴格控量（1份 = 9顆），避免連續大量食用",
    "_meta": { "last_updated": "2026-04-07" }
  }
]
